Papyrus 2341,"Letter and Account from the Archive of Zenon (P.Lond. VII 2083, TM 1644; P.Lond. VII 2149, TM 1709)",http://www.bl.uk/manuscripts/FullDisplay.aspx?ref=Papyrus_2341,,,,,,,,,,,,,,,,,,,,,,,,,,,,,,,,,,,,,,,,,,,,,,,,,,
Papyrus 2342,"Letter from the Archive of Zenon (P.Lond. VII 2084, TM 1645)",http://www.bl.uk/manuscripts/FullDisplay.aspx?ref=Papyrus_2342,,,,,,,,,,,,,,,,,,,,,,,,,,,,,,,,,,,,,,,,,,,,,,,,,,
Papyrus 2343,"Letter to Zenon (P.Lond. VII 1935, TM 2379)",http://www.bl.uk/manuscripts/FullDisplay.aspx?ref=Papyrus_2343,,,,,,,,,,,,,,,,,,,,,,,,,,,,,,,,,,,,,,,,,,,,,,,,,,
Papyrus 2344,"Contract for Land Clearance (P.Cair.Zen. II 59182, TM 828)",http://www.bl.uk/manuscripts/FullDisplay.aspx?ref=Papyrus_2344,,,,,,,,,,,,,,,,,,,,,,,,,,,,,,,,,,,,,,,,,,,,,,,,,,
Papyrus 2345,"Receipt for Wages (P.Lond. VII 1959, TM 1522)",http://www.bl.uk/manuscripts/FullDisplay.aspx?ref=Papyrus_2345,,,,,,,,,,,,,,,,,,,,,,,,,,,,,,,,,,,,,,,,,,,,,,,,,,
Papyrus 2346,"Letter to Zenon (P.Lond. VII 2013, TM 1575)",http://www.bl.uk/manuscripts/FullDisplay.aspx?ref=Papyrus_2346,,,,,,,,,,,,,,,,,,,,,,,,,,,,,,,,,,,,,,,,,,,,,,,,,,
Papyrus 2348,"Letter from the Archive of Zenon (P.Lond. VII 1965, TM 1528)",http://www.bl.uk/manuscripts/FullDisplay.aspx?ref=Papyrus_2348,,,,,,,,,,,,,,,,,,,,,,,,,,,,,,,,,,,,,,,,,,,,,,,,,,
Papyrus 2349,"Letter to Zenon (P.Lond. VII 2053, TM 1615)",http://www.bl.uk/manuscripts/FullDisplay.aspx?ref=Papyrus_2349,,,,,,,,,,,,,,,,,,,,,,,,,,,,,,,,,,,,,,,,,,,,,,,,,,
Papyrus 235,"Report from the Abinnaeus Archive (P.Abinn. 29, P.Lond. II 235, TM 10026) ",http://www.bl.uk/manuscripts/FullDisplay.aspx?ref=Papyrus_235,,,,,,,,,,,,,,,,,,,,,,,,,,,,,,,,,,,,,,,,,,,,,,,,,,
Papyrus 2350,"Letter and Accounts from the Archive of Zenon (P.Lond. VII 2087, TM 1648; P.Lond. VII 2150, TM 1710)",http://www.bl.uk/manuscripts/FullDisplay.aspx?ref=Papyrus_2350(A-B),,,,,,,,,,,,,,,,,,,,,,,,,,,,,,,,,,,,,,,,,,,,,,,,,,
Papyrus 2351,"Letter to Zenon (P.Lond. VII 2057, TM 1619)",http://www.bl.uk/manuscripts/FullDisplay.aspx?ref=Papyrus_2351,,,,,,,,,,,,,,,,,,,,,,,,,,,,,,,,,,,,,,,,,,,,,,,,,,
Papyrus 2352,"Letter to Zenon (P.Lond. VII 1943, TM 1510)",http://www.bl.uk/manuscripts/FullDisplay.aspx?ref=Papyrus_2352,,,,,,,,,,,,,,,,,,,,,,,,,,,,,,,,,,,,,,,,,,,,,,,,,,
Papyrus 236,"Letter on the Dispatch of Articles from the Abinnaeus Archive (P.Abinn. 4, P.Lond. II 236, TM 10032) ",http://www.bl.uk/manuscripts/FullDisplay.aspx?ref=Papyrus_236,,,,,,,,,,,,,,,,,,,,,,,,,,,,,,,,,,,,,,,,,,,,,,,,,,
Papyrus 2360,"Accounts of Grains from the Zenon Archive (P.Lond. VII 1994, TM 1556)",http://www.bl.uk/manuscripts/FullDisplay.aspx?ref=Papyrus_2360,,,,,,,,,,,,,,,,,,,,,,,,,,,,,,,,,,,,,,,,,,,,,,,,,,
Papyrus 2361,"Accounts of Grains from the Zenon Archive (P.Lond. VII 1995, TM 1557)",http://www.bl.uk/manuscripts/FullDisplay.aspx?ref=Papyrus_2361,,,,,,,,,,,,,,,,,,,,,,,,,,,,,,,,,,,,,,,,,,,,,,,,,,
Papyrus 2363,"Complaint to the Village Scribe (P.Lond. VII 1980, TM 1543)",http://www.bl.uk/manuscripts/FullDisplay.aspx?ref=Papyrus_2363,,,,,,,,,,,,,,,,,,,,,,,,,,,,,,,,,,,,,,,,,,,,,,,,,,
Papyrus 2365 (A-B),"Documents from the Archive of Zenon (P.Lond. VII 2101-2102, TM 1662-1663)",http://www.bl.uk/manuscripts/FullDisplay.aspx?ref=Papyrus_2365(A-B),,,,,,,,,,,,,,,,,,,,,,,,,,,,,,,,,,,,,,,,,,,,,,,,,,
Papyrus 2367(A-B),"Letter from the Archive of Zenon (P.Lond. VII 2103, TM 1664)",http://www.bl.uk/manuscripts/FullDisplay.aspx?ref=Papyrus_2367(A-B),,,,,,,,,,,,,,,,,,,,,,,,,,,,,,,,,,,,,,,,,,,,,,,,,,
Papyrus 237,"Letter of Agathus to Abinnaeus concerning the Annona (P.Abinn. 26, P.Lond. II 237, TM 10024) ",http://www.bl.uk/manuscripts/FullDisplay.aspx?ref=Papyrus_237,,,,,,,,,,,,,,,,,,,,,,,,,,,,,,,,,,,,,,,,,,,,,,,,,,
Papyrus 2378(a),"Account from the Archive of Zenon (P.Lond. VII 2004, TM 1566)",http://www.bl.uk/manuscripts/FullDisplay.aspx?ref=Papyrus_2378(A),,,,,,,,,,,,,,,,,,,,,,,,,,,,,,,,,,,,,,,,,,,,,,,,,,
Papyrus 238,"Petition to Abinnaeus (P.Abinn. 50, P.Lond. II 238 descr., SB VIII 9690, TM 10041) ",http://www.bl.uk/manuscripts/FullDisplay.aspx?ref=Papyrus_238,,,,,,,,,,,,,,,,,,,,,,,,,,,,,,,,,,,,,,,,,,,,,,,,,,
Papyrus 2383(A-B),"Account (P.Lond. VII 2166, TM 2388) and List from the Archive of Zenon (P.Lond. VII 2180, TM 2402)",http://www.bl.uk/manuscripts/FullDisplay.aspx?ref=Papyrus_2383(A-B),,,,,,,,,,,,,,,,,,,,,,,,,,,,,,,,,,,,,,,,,,,,,,,,,,
Papyrus 2384(A-C),"Account and List from the Archive of Zenon (P.Lond. VII 1978, TM 1541, P.Lond. VII 2180, TM 2402)",http://www.bl.uk/manuscripts/FullDisplay.aspx?ref=Papyrus_2384(A-C),,,,,,,,,,,,,,,,,,,,,,,,,,,,,,,,,,,,,,,,,,,,,,,,,,
Papyrus 2389,"Account from the Archive of Zenon (P.Lond. VII 2159, TM 1719)",http://www.bl.uk/manuscripts/FullDisplay.aspx?ref=Papyrus_2389,,,,,,,,,,,,,,,,,,,,,,,,,,,,,,,,,,,,,,,,,,,,,,,,,,
Papyrus 239,"Letter of Thareotes to Abinnaeus (P.Abinn. 31, P.Lond. II 239, TM 10028) ",http://www.bl.uk/manuscripts/FullDisplay.aspx?ref=Papyrus_239,,,,,,,,,,,,,,,,,,,,,,,,,,,,,,,,,,,,,,,,,,,,,,,,,,
Papyrus 2393,"Letter to Apollonius (P.Lond. VII 2024, TM 1586)",http://www.bl.uk/manuscripts/FullDisplay.aspx?ref=Papyrus_2393,,,,,,,,,,,,,,,,,,,,,,,,,,,,,,,,,,,,,,,,,,,,,,,,,,
Papyrus 2397,"Medical Treatise on Bones (P.Lond.Lit. 167, TM 65574, LDAB 6825, MP3 2358), and Medical Astrology (P.Lond.Lit. 172, TM 64090, LDAB 5308, MP3 2055) ",http://www.bl.uk/manuscripts/FullDisplay.aspx?ref=Papyrus_2397,,,,,,,,,,,,,,,,,,,,,,,,,,,,,,,,,,,,,,,,,,,,,,,,,,
Papyrus 240,"Petition of Aurelia Ataris to Abinnaeus (P.Abinn. 51, P.Lond. II 240, TM 10042) ",http://www.bl.uk/manuscripts/FullDisplay.aspx?ref=Papyrus_240,,,,,,,,,,,,,,,,,,,,,,,,,,,,,,,,,,,,,,,,,,,,,,,,,,
Papyrus 241,"Petition of Aurelia Ataris to Abinnaeus (P.Abinn. 52, P.Lond. II 241, TM 10043) ",http://www.bl.uk/manuscripts/FullDisplay.aspx?ref=Papyrus_241,,,,,,,,,,,,,,,,,,,,,,,,,,,,,,,,,,,,,,,,,,,,,,,,,,
Papyrus 2415,"Epikrisis Application for Admission to Tax-Privileged Group (SB XII 10890, TM 14349)",http://www.bl.uk/manuscripts/FullDisplay.aspx?ref=Papyrus_2415,,,,,,,,,,,,,,,,,,,,,,,,,,,,,,,,,,,,,,,,,,,,,,,,,,
Papyrus 242,"Petition of Aboul to Abinnaeus (P.Abinn. 48, P.Lond. II 242, TM 10038) ",http://www.bl.uk/manuscripts/FullDisplay.aspx?ref=Papyrus_242,,,,,,,,,,,,,,,,,,,,,,,,,,,,,,,,,,,,,,,,,,,,,,,,,,
Papyrus 2420,"Receipt for Transport-Fees (SB XII 10889, TM 14348)",http://www.bl.uk/manuscripts/FullDisplay.aspx?ref=Papyrus_2420,,,,,,,,,,,,,,,,,,,,,,,,,,,,,,,,,,,,,,,,,,,,,,,,,,
Papyrus 243,"Letter of Apa Mios to Abinnaeus (P.Abinn. 8, P.Lond. II 243, TM 10065) ",http://www.bl.uk/manuscripts/FullDisplay.aspx?ref=Papyrus_243,,,,,,,,,,,,,,,,,,,,,,,,,,,,,,,,,,,,,,,,,,,,,,,,,,
Papyrus 2435,"Abstracts of Contracts (P.Oxy. XIV 1648, TM 29012), and Acta Alexandrinorum (P.Oxy. I 33, P.Lond.Lit. 119, Chrest.Wilck. 20, TM 58945, LDAB 40)",http://www.bl.uk/manuscripts/FullDisplay.aspx?ref=Papyrus_2435,,,,,,,,,,,,,,,,,,,,,,,,,,,,,,,,,,,,,,,,,,,,,,,,,,
Papyrus 2437,"Military Requisitions (P.Oxy. X 1253, TM 33634) ",http://www.bl.uk/manuscripts/FullDisplay.aspx?ref=Papyrus_2437,,,,,,,,,,,,,,,,,,,,,,,,,,,,,,,,,,,,,,,,,,,,,,,,,,
Papyrus 2438,"Statement concerning a Decaprotus and Accounts (P.Oxy. X 1257, TM 21795) ",http://www.bl.uk/manuscripts/FullDisplay.aspx?ref=Papyrus_2438,,,,,,,,,,,,,,,,,,,,,,,,,,,,,,,,,,,,,,,,,,,,,,,,,,
Papyrus 2439,"Contract of a Loan (P.Oxy. X 1281, CPJ III 414, TM 21761) ",http://www.bl.uk/manuscripts/FullDisplay.aspx?ref=Papyrus_2439,,,,,,,,,,,,,,,,,,,,,,,,,,,,,,,,,,,,,,,,,,,,,,,,,,
Papyrus 244,"Letter of Apollos to Abinnaeus (P.Abinn. 22, P.Lond. II 244, SB VI 9023, TM 10022) ",http://www.bl.uk/manuscripts/FullDisplay.aspx?ref=Papyrus_244,,,,,,,,,,,,,,,,,,,,,,,,,,,,,,,,,,,,,,,,,,,,,,,,,,
Papyrus 2440,"Receipt for Tax on Sale (P.Oxy. X 1284, TM 21787) ",http://www.bl.uk/manuscripts/FullDisplay.aspx?ref=Papyrus_2440,,,,,,,,,,,,,,,,,,,,,,,,,,,,,,,,,,,,,,,,,,,,,,,,,,
Papyrus 2441,"Private Letter of Sarmates (P.Oxy. X 1297, TM 33636) ",http://www.bl.uk/manuscripts/FullDisplay.aspx?ref=Papyrus_2441,,,,,,,,,,,,,,,,,,,,,,,,,,,,,,,,,,,,,,,,,,,,,,,,,,
Papyrus 2442,"Calendar of Church Services (P.Oxy. XI 1357, P.Lond.Lit. 233, TM 65049, LDAB 6290) ",http://www.bl.uk/manuscripts/FullDisplay.aspx?ref=Papyrus_2442,,,,,,,,,,,,,,,,,,,,,,,,,,,,,,,,,,,,,,,,,,,,,,,,,,
Papyrus 2443,"Bacchylides’ Encomia (?) with scholia (P.Oxy. XI 1361+P.Oxy. XVII 2081(e), P.Lond.Lit. 48, TM 59337, LDAB 436, MP3 179) ",http://www.bl.uk/manuscripts/FullDisplay.aspx?ref=Papyrus_2443,,,,,,,,,,,,,,,,,,,,,,,,,,,,,,,,,,,,,,,,,,,,,,,,,,
Papyrus 2445,"Thucydides, Historiae VII (P.Oxy. XI 1376, P.Lond.Lit. 107, TM 62887, LDAB 4078, MP3 1531) ",http://www.bl.uk/manuscripts/FullDisplay.aspx?ref=Papyrus_2445,,,,,,,,,,,,,,,,,,,,,,,,,,,,,,,,,,,,,,,,,,,,,,,,,,
Papyrus 2446,"Homer, Iliad XV (P.Oxy. XI 1392, P.Lond.Lit. 23, TM 60831, LDAB 1959, MP3 921) ",http://www.bl.uk/manuscripts/FullDisplay.aspx?ref=Papyrus_2446,,,,,,,,,,,,,,,,,,,,,,,,,,,,,,,,,,,,,,,,,,,,,,,,,,
Papyrus 2447,"Rescript of Severus and Application to a Strategus (P.Oxy. XII 1405, TM 21815) ",http://www.bl.uk/manuscripts/FullDisplay.aspx?ref=Papyrus_2447,,,,,,,,,,,,,,,,,,,,,,,,,,,,,,,,,,,,,,,,,,,,,,,,,,
Papyrus 2448,"Edict of Caracalla (P.Oxy. XII 1406, TM 21816) ",http://www.bl.uk/manuscripts/FullDisplay.aspx?ref=Papyrus_2448,,,,,,,,,,,,,,,,,,,,,,,,,,,,,,,,,,,,,,,,,,,,,,,,,,
Papyrus 2449,"Imperial Rescripts (P.Oxy. XII 1407, TM 31739) ",http://www.bl.uk/manuscripts/FullDisplay.aspx?ref=Papyrus_2449,,,,,,,,,,,,,,,,,,,,,,,,,,,,,,,,,,,,,,,,,,,,,,,,,,
Papyrus 245,"Petition to Abinnaeus on Burglary (P.Abinn. 45, P.Lond. II 245, TM 10035) ",http://www.bl.uk/manuscripts/FullDisplay.aspx?ref=Papyrus_245,,,,,,,,,,,,,,,,,,,,,,,,,,,,,,,,,,,,,,,,,,,,,,,,,,
Papyrus 2451,"Taxation-Return concerning Pastophori (P.Oxy. XII 1435, TM 21839), and Account of Village-Taxes (P.Oxy. XII 1436, TM 21840) ",http://www.bl.uk/manuscripts/FullDisplay.aspx?ref=Papyrus_2451,,,,,,,,,,,,,,,,,,,,,,,,,,,,,,,,,,,,,,,,,,,,,,,,,,
Papyrus 2452,"Receipt for Payment of Taxes (P.Oxy. XII 1442, TM 21845) ",http://www.bl.uk/manuscripts/FullDisplay.aspx?ref=Papyrus_2452,,,,,,,,,,,,,,,,,,,,,,,,,,,,,,,,,,,,,,,,,,,,,,,,,,
Papyrus 2453,"Estimate of Repairing a Public Building (P.Oxy. XII 1450, TM 21851) ",http://www.bl.uk/manuscripts/FullDisplay.aspx?ref=Papyrus_2453,,,,,,,,,,,,,,,,,,,,,,,,,,,,,,,,,,,,,,,,,,,,,,,,,,
Papyrus 2454,"Sworn Declaration of Temple Lamp-Lighters (P.Oxy. XII 1453, TM 21854) ",http://www.bl.uk/manuscripts/FullDisplay.aspx?ref=Papyrus_2454,,,,,,,,,,,,,,,,,,,,,,,,,,,,,,,,,,,,,,,,,,,,,,,,,,
Papyrus 2455,"Sworn Undertaking of an Oil-Seller (P.Oxy. XII 1455, TM 21856) ",http://www.bl.uk/manuscripts/FullDisplay.aspx?ref=Papyrus_2455,,,,,,,,,,,,,,,,,,,,,,,,,,,,,,,,,,,,,,,,,,,,,,,,,,
Papyrus 2456,"Declaration on Oath concerning Appearance in Court (P.Oxy. XII 1456, TM 21857) ",http://www.bl.uk/manuscripts/FullDisplay.aspx?ref=Papyrus_2456,,,,,,,,,,,,,,,,,,,,,,,,,,,,,,,,,,,,,,,,,,,,,,,,,,
Papyrus 2457,"Declaration of Pagan Sacrifice and Account (P.Oxy. XII 1464, TM 21866) ",http://www.bl.uk/manuscripts/FullDisplay.aspx?ref=Papyrus_2457,,,,,,,,,,,,,,,,,,,,,,,,,,,,,,,,,,,,,,,,,,,,,,,,,,
Papyrus 2458,"Petition to the Prefect by Aurelia Thaisous alias Lolliane (P.Oxy. XII 1467, TM 21868) ",http://www.bl.uk/manuscripts/FullDisplay.aspx?ref=Papyrus_2458,,,,,,,,,,,,,,,,,,,,,,,,,,,,,,,,,,,,,,,,,,,,,,,,,,
Papyrus 2459,"Application concerning Deposits (P.Oxy. XII 1472, TM 21873) ",http://www.bl.uk/manuscripts/FullDisplay.aspx?ref=Papyrus_2459,,,,,,,,,,,,,,,,,,,,,,,,,,,,,,,,,,,,,,,,,,,,,,,,,,
Papyrus 246,"Undertaking from the Abinnaeus Archive (P.Abinn. 61, P.Lond. II 246, TM 10053) ",http://www.bl.uk/manuscripts/FullDisplay.aspx?ref=Papyrus_246,,,,,,,,,,,,,,,,,,,,,,,,,,,,,,,,,,,,,,,,,,,,,,,,,,
Papyrus 2460,"Application concerning a Remarriage (P.Oxy. XII 1473, TM 21874) ",http://www.bl.uk/manuscripts/FullDisplay.aspx?ref=Papyrus_2460,,,,,,,,,,,,,,,,,,,,,,,,,,,,,,,,,,,,,,,,,,,,,,,,,,
Papyrus 2462,"Letter of the Bishop Sotas on a Donation (P.Oxy. XII 1492, TM 31748) ",http://www.bl.uk/manuscripts/FullDisplay.aspx?ref=Papyrus_2462,,,,,,,,,,,,,,,,,,,,,,,,,,,,,,,,,,,,,,,,,,,,,,,,,,
Papyrus 2463,"Report of a Trial and Lease of Land (P.Oxy. XII 1502, TM 21884-21885) ",http://www.bl.uk/manuscripts/FullDisplay.aspx?ref=Papyrus_2463,,,,,,,,,,,,,,,,,,,,,,,,,,,,,,,,,,,,,,,,,,,,,,,,,,
Papyrus 2464,"Report concerning a Veteran (P.Oxy. XII 1508, TM 28999), and List of Land-holders (P.Oxy. XII 1536, TM 29004) ",http://www.bl.uk/manuscripts/FullDisplay.aspx?ref=Papyrus_2464,,,,,,,,,,,,,,,,,,,,,,,,,,,,,,,,,,,,,,,,,,,,,,,,,,
Papyrus 2465,"Petition to the Chief of Police (P.Oxy. XII 1559, TM 21925)",http://www.bl.uk/manuscripts/FullDisplay.aspx?ref=Papyrus_2465 ,,,,,,,,,,,,,,,,,,,,,,,,,,,,,,,,,,,,,,,,,,,,,,,,,,
Papyrus 2466,"Letter from Alexandria (?) (P.Oxy. XII 1589, TM 33659), and Order for Payment of Barley (P.Oxy. XII 1575, TM 21938) ",http://www.bl.uk/manuscripts/FullDisplay.aspx?ref=Papyrus_2466,,,,,,,,,,,,,,,,,,,,,,,,,,,,,,,,,,,,,,,,,,,,,,,,,,
Papyrus 2467,"The Shepherd of Hermas (P.Oxy. XIII 1599, P.Lond.Lit. 225, TM 59992, LDAB 1104) ",http://www.bl.uk/manuscripts/FullDisplay.aspx?ref=Papyrus_2467,,,,,,,,,,,,,,,,,,,,,,,,,,,,,,,,,,,,,,,,,,,,,,,,,,
Papyrus 2468,"Hyperides(?), Pro Lycophrone (P.Oxy. XIII 1607, P.Lond.Lit. 135, TM 61285, LDAB 2427, MP3 2500) ",http://www.bl.uk/manuscripts/FullDisplay.aspx?ref=Papyrus_2468,,,,,,,,,,,,,,,,,,,,,,,,,,,,,,,,,,,,,,,,,,,,,,,,,,
Papyrus 2469,"Aeschines Socraticus, Alcibiades (P.Oxy. XIII 1608, P.Lond.Lit. 148, CPF I.1.1 8, TM 58965, LDAB 60, MP3 19) ",http://www.bl.uk/manuscripts/FullDisplay.aspx?ref=Papyrus_2469,,,,,,,,,,,,,,,,,,,,,,,,,,,,,,,,,,,,,,,,,,,,,,,,,,
Papyrus 247,"Account from the Abinnaeus Archive (P.Abinn. 81, P.Lond. II 247, TM 10066) ",http://www.bl.uk/manuscripts/FullDisplay.aspx?ref=Papyrus_247,,,,,,,,,,,,,,,,,,,,,,,,,,,,,,,,,,,,,,,,,,,,,,,,,,
Papyrus 2470,"Ephorus, Historiae XII or XI (P.Oxy. XIII 1610, P.Lond.Lit. 109, TM 59723, LDAB 827, MP3 357) ",http://www.bl.uk/manuscripts/FullDisplay.aspx?ref=Papyrus_2470,,,,,,,,,,,,,,,,,,,,,,,,,,,,,,,,,,,,,,,,,,,,,,,,,,
Papyrus 2471,"Thucydides, Collected Speeches from Historiae II (P.Oxy. XIII 1621, P.Lond.Lit. 106, TM 62919, LDAB 4111, MP3 1513) ",http://www.bl.uk/manuscripts/FullDisplay.aspx?ref=Papyrus_2471,,,,,,,,,,,,,,,,,,,,,,,,,,,,,,,,,,,,,,,,,,,,,,,,,,
Papyrus 2472,"Lease of Catoecic Land (P.Oxy. XIV 1628, TM 5254) ",http://www.bl.uk/manuscripts/FullDisplay.aspx?ref=Papyrus_2472,,,,,,,,,,,,,,,,,,,,,,,,,,,,,,,,,,,,,,,,,,,,,,,,,,
Papyrus 2473,"Lease of Catoecic Land (P.Oxy. XIV 1629, TM 5255) ",http://www.bl.uk/manuscripts/FullDisplay.aspx?ref=Papyrus_2473,,,,,,,,,,,,,,,,,,,,,,,,,,,,,,,,,,,,,,,,,,,,,,,,,,
Papyrus 2474,"Contract for Labour in a Vineyard and Lease of a Fruit-Garden (P.Oxy. XIV 1631, TM 21943) ",http://www.bl.uk/manuscripts/FullDisplay.aspx?ref=Papyrus_2474,,,,,,,,,,,,,,,,,,,,,,,,,,,,,,,,,,,,,,,,,,,,,,,,,,
Papyrus 2475,"Bid for Purchase of Land (P.Oxy. XIV 1633, TM 21945) ",http://www.bl.uk/manuscripts/FullDisplay.aspx?ref=Papyrus_2475,,,,,,,,,,,,,,,,,,,,,,,,,,,,,,,,,,,,,,,,,,,,,,,,,,
Papyrus 2476,"Settlement of Claims (P.Oxy. XIV 1644, TM 5258) ",http://www.bl.uk/manuscripts/FullDisplay.aspx?ref=Papyrus_2476,,,,,,,,,,,,,,,,,,,,,,,,,,,,,,,,,,,,,,,,,,,,,,,,,,
Papyrus 2477,"Land-Survey List and Account of Notarial Expenses (P.Oxy. XIV 1654, TM 21959) ",http://www.bl.uk/manuscripts/FullDisplay.aspx?ref=Papyrus_2477,,,,,,,,,,,,,,,,,,,,,,,,,,,,,,,,,,,,,,,,,,,,,,,,,,
Papyrus 2478,"Account of Crown-Tax (P.Oxy. XIV 1659, TM 21961) ",http://www.bl.uk/manuscripts/FullDisplay.aspx?ref=Papyrus_2478,,,,,,,,,,,,,,,,,,,,,,,,,,,,,,,,,,,,,,,,,,,,,,,,,,
Papyrus 2479,"Private Letter (P.Oxy. XIV 1666, TM 31777)",http://www.bl.uk/manuscripts/FullDisplay.aspx?ref=Papyrus_2479 ,,,,,,,,,,,,,,,,,,,,,,,,,,,,,,,,,,,,,,,,,,,,,,,,,,
Papyrus 248,"Letter of Abinnaeus (P.Abinn. 43, P.Lond. II 248, TM 10033) ",http://www.bl.uk/manuscripts/FullDisplay.aspx?ref=Papyrus_248,,,,,,,,,,,,,,,,,,,,,,,,,,,,,,,,,,,,,,,,,,,,,,,,,,
Papyrus 2480,"Sale of House-Property (P.Oxy. XIV 1698, TM 31791) ",http://www.bl.uk/manuscripts/FullDisplay.aspx?ref=Papyrus_2480,,,,,,,,,,,,,,,,,,,,,,,,,,,,,,,,,,,,,,,,,,,,,,,,,,
Papyrus 2481,"Sale of Female Slaves (P.Oxy. XIV 1706, TM 21984) and List of Contracts (P.Oxy. XIV 1726, TM 31796) ",http://www.bl.uk/manuscripts/FullDisplay.aspx?ref=Papyrus_2481,,,,,,,,,,,,,,,,,,,,,,,,,,,,,,,,,,,,,,,,,,,,,,,,,,
Papyrus 2482,"Fragmentary Lists (P.Oxy. XIV 1744, TM 22000) ",http://www.bl.uk/manuscripts/FullDisplay.aspx?ref=Papyrus_2482,,,,,,,,,,,,,,,,,,,,,,,,,,,,,,,,,,,,,,,,,,,,,,,,,,
Papyrus 2483,"Order for Payment (P.Oxy. XIV 1753, TM 22004) ",http://www.bl.uk/manuscripts/FullDisplay.aspx?ref=Papyrus_2483,,,,,,,,,,,,,,,,,,,,,,,,,,,,,,,,,,,,,,,,,,,,,,,,,,
Papyrus 2484,"Fragment of the Gospel of John (Gregory-Aland P5; P. Lond. Lit. 213; P. Oxy. II 208; TM 61630), containing part of chapter 16",http://www.bl.uk/manuscripts/FullDisplay.aspx?ref=Papyrus_2484,,,,,,,,,,,,,,,,,,,,,,,,,,,,,,,,,,,,,,,,,,,,,,,,,,
Papyrus 2486,"Song of Songs with Aristides's Apology (P. Lond. Lit. 209; Rahfls 952; van Haelst 269; TM 62307 and P. Lond. Lit. 223; van Haelst 624.) 
",http://www.bl.uk/manuscripts/FullDisplay.aspx?ref=Papyrus_2486,,,,,,,,,,,,,,,,,,,,,,,,,,,,,,,,,,,,,,,,,,,,,,,,,,
Papyrus 2487,"Letter from the Archive of Paieous (P.Lond. VI 1914, TM 16852) ",http://www.bl.uk/manuscripts/FullDisplay.aspx?ref=Papyrus_2487,,,,,,,,,,,,,,,,,,,,,,,,,,,,,,,,,,,,,,,,,,,,,,,,,,
Papyrus 2488,"Private Letter to Paieous about Clothing (P.Lond. VI 1920, SB Kopt. III 1311, TM 44659) ",http://www.bl.uk/manuscripts/FullDisplay.aspx?ref=Papyrus_2488,,,,,,,,,,,,,,,,,,,,,,,,,,,,,,,,,,,,,,,,,,,,,,,,,,
Papyrus 2489,"Letter to Apa Paieous Requesting Prayers (P.Lond. VI 1917, TM 16855) ",http://www.bl.uk/manuscripts/FullDisplay.aspx?ref=Papyrus_2489,,,,,,,,,,,,,,,,,,,,,,,,,,,,,,,,,,,,,,,,,,,,,,,,,,
Papyrus 249,"Account from the Abinnaeus Archive (P.Abinn. 75, P.Lond. II 249, TM 10062) ",http://www.bl.uk/manuscripts/FullDisplay.aspx?ref=Papyrus_249,,,,,,,,,,,,,,,,,,,,,,,,,,,,,,,,,,,,,,,,,,,,,,,,,,
Papyrus 2491,"Private Letter to Papnuthius (P.Lond. VI 1923, TM 32656) ",http://www.bl.uk/manuscripts/FullDisplay.aspx?ref=Papyrus_2491,,,,,,,,,,,,,,,,,,,,,,,,,,,,,,,,,,,,,,,,,,,,,,,,,,
Papyrus 2492,"Private Letter to Papnuthius (P.Lond. VI 1924, TM 32657) ",http://www.bl.uk/manuscripts/FullDisplay.aspx?ref=Papyrus_2492,,,,,,,,,,,,,,,,,,,,,,,,,,,,,,,,,,,,,,,,,,,,,,,,,,
Papyrus 2493,"Letter from the Archive of Papnuthius (P.Lond. VI 1925, TM 32658) ",http://www.bl.uk/manuscripts/FullDisplay.aspx?ref=Papyrus_2493,,,,,,,,,,,,,,,,,,,,,,,,,,,,,,,,,,,,,,,,,,,,,,,,,,
Papyrus 2494,"Private Letter from Valeria to Papnuthius (P.Lond. VI 1926, TM 32659, MP3 6061) ",http://www.bl.uk/manuscripts/FullDisplay.aspx?ref=Papyrus_2494,,,,,,,,,,,,,,,,,,,,,,,,,,,,,,,,,,,,,,,,,,,,,,,,,,
Papyrus 2495,"Private Letter from Dorotheus to Papnuthius (P.Lond. VI 1927, TM 32660) ",http://www.bl.uk/manuscripts/FullDisplay.aspx?ref=Papyrus_2495,,,,,,,,,,,,,,,,,,,,,,,,,,,,,,,,,,,,,,,,,,,,,,,,,,
Papyrus 2496,"Private Letter to Papnuthius (P.Lond. VI 1928, TM 32661) ",http://www.bl.uk/manuscripts/FullDisplay.aspx?ref=Papyrus_2496,,,,,,,,,,,,,,,,,,,,,,,,,,,,,,,,,,,,,,,,,,,,,,,,,,
Papyrus 2497,"Private Letter from Athanasius to Papnuthius (P.Lond. VI 1929, TM 32662) ",http://www.bl.uk/manuscripts/FullDisplay.aspx?ref=Papyrus_2497,,,,,,,,,,,,,,,,,,,,,,,,,,,,,,,,,,,,,,,,,,,,,,,,,,
Papyrus 250,"List of Animals from the Abinnaeus Archive (P.Abinn. 71, P.Lond. II 250, TM 10060) ",http://www.bl.uk/manuscripts/FullDisplay.aspx?ref=Papyrus_250,,,,,,,,,,,,,,,,,,,,,,,,,,,,,,,,,,,,,,,,,,,,,,,,,,
Papyrus 2505,"Sale of a Female Donkey (P.Diog. 28, TM 10700) ",http://www.bl.uk/manuscripts/FullDisplay.aspx?ref=Papyrus_2505,,,,,,,,,,,,,,,,,,,,,,,,,,,,,,,,,,,,,,,,,,,,,,,,,,
Papyrus 2508,"Application for Lease of Land (P.Diog. 29, TM 10701) ",http://www.bl.uk/manuscripts/FullDisplay.aspx?ref=Papyrus_2508,,,,,,,,,,,,,,,,,,,,,,,,,,,,,,,,,,,,,,,,,,,,,,,,,,
Papyrus 251,"Sale of Two Slaves (P.Abinn. 64, P.Lond. II 251, Chrest.Mitt. 270, TM 10055) ",http://www.bl.uk/manuscripts/FullDisplay.aspx?ref=Papyrus_251,,,,,,,,,,,,,,,,,,,,,,,,,,,,,,,,,,,,,,,,,,,,,,,,,,
Papyrus 2511,"Account (P.Diog. 52, TM 26626)",http://www.bl.uk/manuscripts/FullDisplay.aspx?ref=Papyrus_2511,,,,,,,,,,,,,,,,,,,,,,,,,,,,,,,,,,,,,,,,,,,,,,,,,,
Papyrus 2512,"Loan of Money (P.Diog. 25, TM 10697) ",http://www.bl.uk/manuscripts/FullDisplay.aspx?ref=Papyrus_2512,,,,,,,,,,,,,,,,,,,,,,,,,,,,,,,,,,,,,,,,,,,,,,,,,,
Papyrus 2513,"Petition about Mortgaged Land (P.Diog. 17, TM 26616)",http://www.bl.uk/manuscripts/FullDisplay.aspx?ref=Papyrus_2513,,,,,,,,,,,,,,,,,,,,,,,,,,,,,,,,,,,,,,,,,,,,,,,,,,
Papyrus 2518,"Receipt of Payment (P.Diog. 36, TM 26620)",http://www.bl.uk/manuscripts/FullDisplay.aspx?ref=Papyrus_2518,,,,,,,,,,,,,,,,,,,,,,,,,,,,,,,,,,,,,,,,,,,,,,,,,,
Papyrus 252,"List from the Abinnaeus Archive (P.Abinn. 72, P.Lond. II 252, TM 10061) ",http://www.bl.uk/manuscripts/FullDisplay.aspx?ref=Papyrus_252,,,,,,,,,,,,,,,,,,,,,,,,,,,,,,,,,,,,,,,,,,,,,,,,,,
Papyrus 2521,"Tax Receipt? (P.Diog. 53, TM 26627)",http://www.bl.uk/manuscripts/FullDisplay.aspx?ref=Papyrus_2521,,,,,,,,,,,,,,,,,,,,,,,,,,,,,,,,,,,,,,,,,,,,,,,,,,
Papyrus 2524,"Lease of Land (P.Diog. 33, TM 10703)",http://www.bl.uk/manuscripts/FullDisplay.aspx?ref=Papyrus_2524,,,,,,,,,,,,,,,,,,,,,,,,,,,,,,,,,,,,,,,,,,,,,,,,,,
Papyrus 253,"Accounts from the Abinnaeus Archive (P.Abinn. 69 ro., SB VIII 9693 ro., P.Lond. II 259 ro. descr., TM 32682; P.Abinn. 69 vo., SB VIII 9693 vo., P.Lond. II 259 vo. descr., TM 32683) ",http://www.bl.uk/manuscripts/FullDisplay.aspx?ref=Papyrus_253,,,,,,,,,,,,,,,,,,,,,,,,,,,,,,,,,,,,,,,,,,,,,,,,,,
Papyrus 2532,"List of Payments in Kind (P.Diog. 44, TM 10711)",http://www.bl.uk/manuscripts/FullDisplay.aspx?ref=Papyrus_2532,,,,,,,,,,,,,,,,,,,,,,,,,,,,,,,,,,,,,,,,,,,,,,,,,,
Papyrus 2533,"Gift in Contemplation of Death (P.Diog. 12, TM 10691)",http://www.bl.uk/manuscripts/FullDisplay.aspx?ref=Papyrus_2533,,,,,,,,,,,,,,,,,,,,,,,,,,,,,,,,,,,,,,,,,,,,,,,,,,
Papyrus 2534,"List of Gratuities? (P.Diog. 47, TM 26623)",http://www.bl.uk/manuscripts/FullDisplay.aspx?ref=Papyrus_2534,,,,,,,,,,,,,,,,,,,,,,,,,,,,,,,,,,,,,,,,,,,,,,,,,,
Papyrus 2535,"Sale of Land (P.Diog. 24, TM 10696)",http://www.bl.uk/manuscripts/FullDisplay.aspx?ref=Papyrus_2535,,,,,,,,,,,,,,,,,,,,,,,,,,,,,,,,,,,,,,,,,,,,,,,,,,
Papyrus 2536,"Lease of Land (P.Diog. 26, TM 10698)",http://www.bl.uk/manuscripts/FullDisplay.aspx?ref=Papyrus_2536,,,,,,,,,,,,,,,,,,,,,,,,,,,,,,,,,,,,,,,,,,,,,,,,,,
Papyrus 2537,"Private Letter (P.Diog. 48, TM 26624)",http://www.bl.uk/manuscripts/FullDisplay.aspx?ref=Papyrus_2537,,,,,,,,,,,,,,,,,,,,,,,,,,,,,,,,,,,,,,,,,,,,,,,,,,
Papyrus 2541,"List of Payments in Kind (P.Diog. 45, TM 10712), and Receipt for Rent (P.Diog. 34, TM 10704)",http://www.bl.uk/manuscripts/FullDisplay.aspx?ref=Papyrus_2541,,,,,,,,,,,,,,,,,,,,,,,,,,,,,,,,,,,,,,,,,,,,,,,,,,
Papyrus 2542,"Gift in Contemplation of Death (P.Diog. 11, TM 10690) ",http://www.bl.uk/manuscripts/FullDisplay.aspx?ref=Papyrus_2542,,,,,,,,,,,,,,,,,,,,,,,,,,,,,,,,,,,,,,,,,,,,,,,,,,
Papyrus 2543,"Appointment of a Deputy in the Monastery of Hathor (P.Lond. VI 1913, TM 16857) ",http://www.bl.uk/manuscripts/FullDisplay.aspx?ref=Papyrus_2543,,,,,,,,,,,,,,,,,,,,,,,,,,,,,,,,,,,,,,,,,,,,,,,,,,
Papyrus 2544,"Letter to Paieous Concerning a Debtor (P.Lond. VI 1915, SB Kopt. III 1668, TM 16853) ",http://www.bl.uk/manuscripts/FullDisplay.aspx?ref=Papyrus_2544,,,,,,,,,,,,,,,,,,,,,,,,,,,,,,,,,,,,,,,,,,,,,,,,,,
Papyrus 2545,"Letter to Paieous Concerning a Debtor (P.Lond. VI 1916, TM 16854) ",http://www.bl.uk/manuscripts/FullDisplay.aspx?ref=Papyrus_2545,,,,,,,,,,,,,,,,,,,,,,,,,,,,,,,,,,,,,,,,,,,,,,,,,,
Papyrus 2546,"Letter to Paieous on the Delivery of Supplies (P.Lond. VI 1918, TM 16856) ",http://www.bl.uk/manuscripts/FullDisplay.aspx?ref=Papyrus_2546,,,,,,,,,,,,,,,,,,,,,,,,,,,,,,,,,,,,,,,,,,,,,,,,,,
Papyrus 2547,"Letter to Apa Paieous (P.Lond. VI 1919, TM 16857) ",http://www.bl.uk/manuscripts/FullDisplay.aspx?ref=Papyrus_2547,,,,,,,,,,,,,,,,,,,,,,,,,,,,,,,,,,,,,,,,,,,,,,,,,,
Papyrus 2548,"Letter on Supplies (P.Lond. VI 1922, SB Kopt. III 1313, TM 44661) ",http://www.bl.uk/manuscripts/FullDisplay.aspx?ref=Papyrus_2548,,,,,,,,,,,,,,,,,,,,,,,,,,,,,,,,,,,,,,,,,,,,,,,,,,
Papyrus 2549,"Letter on the Dispatch of Some Articles (P.Lond. VI 1921, SB Kopt. III 1312, TM 44660) ",http://www.bl.uk/manuscripts/FullDisplay.aspx?ref=Papyrus_2549,,,,,,,,,,,,,,,,,,,,,,,,,,,,,,,,,,,,,,,,,,,,,,,,,,
Papyrus 255,"Certificate (P.Lond. II 255, Chrest.Wilck. 272, TM 11656) ",http://www.bl.uk/manuscripts/FullDisplay.aspx?ref=Papyrus_255,,,,,,,,,,,,,,,,,,,,,,,,,,,,,,,,,,,,,,,,,,,,,,,,,,
Papyrus 2553,Letter of Recommendation from Proclus to Asclepiades (TM 10546) ,http://www.bl.uk/manuscripts/FullDisplay.aspx?ref=Papyrus_2553,,,,,,,,,,,,,,,,,,,,,,,,,,,,,,,,,,,,,,,,,,,,,,,,,,
Papyrus 2554,"Request for Cancelling a Loan Agreement Upon Repayment of the Debt (SB V 7634, TM 17992) ",http://www.bl.uk/manuscripts/FullDisplay.aspx?ref=Papyrus_2554,,,,,,,,,,,,,,,,,,,,,,,,,,,,,,,,,,,,,,,,,,,,,,,,,,
Papyrus 2555,"Private Letter (SB V 7635, TM 35115) ",http://www.bl.uk/manuscripts/FullDisplay.aspx?ref=Papyrus_2555,,,,,,,,,,,,,,,,,,,,,,,,,,,,,,,,,,,,,,,,,,,,,,,,,,
Papyrus 2556,"Psalm 2:3-12 (P.Lond.Lit. 204, TM 61958, LDAB 3115) ",http://www.bl.uk/manuscripts/FullDisplay.aspx?ref=Papyrus_2556,,,,,,,,,,,,,,,,,,,,,,,,,,,,,,,,,,,,,,,,,,,,,,,,,,
Papyrus 2557,"Genesis (P.Lond.Lit. 202, TM 61981, LDAB 3140) ",http://www.bl.uk/manuscripts/FullDisplay.aspx?ref=Papyrus_2557,,,,,,,,,,,,,,,,,,,,,,,,,,,,,,,,,,,,,,,,,,,,,,,,,,
